74,Small Business,Wordpress,Content Management and Blog Setup,WP-CMABS-2230,content-management-and-blog-setup,Setting up a blog section and training on content management.  Creating and scheduling blog posts.  Ensuring the blog is optimized for SEO.,Digital Delivery,68564923891739,1,1-3 Business Days,"Custom categories, featured blog designs",350,300 - 500,Project
75,Small Business,Wordpress,Speed Optimization,WP-SO-3133,speed-optimization,"Implementing caching solutions; Image optimization; Minimizing CSS, JavaScript, and HTML",Digital Delivery,50345433926955,1,1-3 Business Days,"Advanced caching strategies, CDN setup",300,250 - 450,Project
76,Medium Business,Wordpress,Advanced Customization and Theme Development,WP-ACATD-5371,advanced-customization-and-theme-development,"Developing custom themes tailored to the brand; Integrating advanced features like custom post types, fields, and taxonomies",Digital Delivery,31052178275457,3,3-5 Business Days,"Additional page templates, custom animations",1000,"800 - 1,500",Project
77,Medium Business,Wordpress,Advanced E-Commerce Solutions,WP-AS-3349,advanced-e-commerce-solutions,Multi-currency and multi-language support.  Integration with CRM and ERP systems.  Subscription-based services and membership sites.,Digital Delivery,85762223738771,3,3-5 Business Days,"Recurring payment options, dynamic pricing",1500,"1,200 - 2,000",Project
78,Medium Business,Wordpress,Custom Plugin Development,WP-CPD-9481,custom-plugin-development,Developing custom plugins to add unique functionality.  Modifying existing plugins to suit specific business needs.,Digital Delivery,70198266636742,1,1-3 Business Days,"Extended plugin functionality, API integrations",1200,"1,000 - 1,800",Project
79,Medium Business,Wordpress,Content Strategy and Management,WP-CSAM-6557,content-strategy-and-management,"Developing a content strategy to drive engagement and conversions; Implementing content marketing tactics, including blogging, video, and social media integration",Digital Delivery,97640415842146,1,1-3 Business Days,"Social media content planning, video editing support",600,500 - 900,Project
80,Medium Business,Wordpress,Analytics and Conversion Optimization,WP-AACO-9811,analytics-and-conversion-optimization,"Setting up Google Analytics, heatmaps, and conversion tracking; A/B testing of pages to improve conversion rates; Implementing user feedback mechanisms like surveys and reviews",Digital Delivery,34822992533965,1,1-3 Business Days,"Detailed funnel analysis, custom tracking reports",700,"600 - 1,000",Project
81,Medium Business,Wordpress,Ongoing Website Maintenance and Performance Optimization,WP-OWMAPO-4354,ongoing-website-maintenance-and-performance-optimization,Regular performance audits and speed enhancements.  Proactive security measures and monitoring.  Custom reports and analytics review sessions.,Digital Delivery,21999041322458,3,3-5 Business Days,"Dedicated account manager, real-time monitoring",500/month,400 - 800/month,Project
82,Large Business,Wordpress,Enterprise-Level WordPress Development,WP-WD-8948,enterprise-level-wordpress-development,"Building scalable WordPress multisite networks; Integrating WordPress with enterprise-level tools and platforms (CRM, ERP, etc.); Developing custom APIs for integration with other systems",Digital Delivery,28480740716832,3,3-5 Business Days,"Custom dashboard integration, enterprise-grade security",3000,"2,500 - 4,500",Project
83,Large Business,Wordpress,Custom Theme and Plugin Development,WP-CTAPD-2055,custom-theme-and-plugin-development,"Designing highly customized, brand-specific themes; Developing enterprise-grade plugins with complex functionalities; Continuous development and iterative updates based on business needs",Digital Delivery,12007701187044,3,3-5 Business Days,"Iterative updates, multi-device testing",2500,"2,000 - 4,000",Project
84,Large Business,Wordpress,Advanced E-Commerce and Marketplace Solutions,WP-AAMS-5334,advanced-e-commerce-and-marketplace-solutions,"Creating large-scale online stores with hundreds or thousands of products; Developing custom checkout processes, user roles, and permission management; Integration with third-party logistics and inventory management systems",Digital Delivery,52542745485413,3,3-5 Business Days,"Advanced inventory management, warehouse integration",5000,"4,000 - 7,500",Project
85,Large Business,Wordpress,Comprehensive SEO and Digital Marketing,WP-CSADM-3201,comprehensive-seo-and-digital-marketing,"Advanced SEO strategies including technical SEO audits, backlinking, and content optimization; Implementing large-scale digital marketing campaigns; Managing and optimizing PPC campaigns and social media ads",Digital Delivery,55213723441930,3,3-5 Business Days,"Custom ad campaigns, ongoing SEO support",2000,"1,500 - 3,000",Project
86,Large Business,Wordpress,Security and Compliance Services,WP-SACS-9845,security-and-compliance-services,"Implementing enterprise-level security protocols; Ensuring compliance with industry regulations (GDPR, CCPA, etc.); Regular security audits and penetration testing",Digital Delivery,47989557632928,3,3-5 Business Days,"Custom security dashboards, vulnerability fixes",1500,"1,200 - 2,000",Project
87,Large Business,Wordpress,High Availability and Performance Optimization,WP-HAAPO-5556,high-availability-and-performance-optimization,"Implementing CDN, advanced caching, and database optimization; Setting up and managing redundant hosting and disaster recovery plans; Ensuring the site can handle high traffic with minimal downtime",Digital Delivery,34077609518227,3,3-5 Business Days,"Failover systems, real-time traffic management",2500,"2,000 - 3,500",Project
88,Large Business,Wordpress,Custom Reporting and Data Analysis,WP-CRADA-7490,custom-reporting-and-data-analysis,Developing custom dashboards and reports for business intelligence.  Integrating WordPress data with other business systems for holistic insights.  Ongoing data analysis to inform strategy and decision-making.,Digital Delivery,94149840457049,3,3-5 Business Days,"Interactive dashboards, predictive analytics",800,"700 - 1,200",Project
89,All Business Sizes,Wordpress,Training and Consulting,WP-TAC-2496,training-and-consulting,Providing WordPress training for in-house teams.  Offering consultation services on best practices and digital strategy.,Digital Delivery,49726664353560,1,1-3 Business Days,"Custom training modules, hands-on workshops",500,400 - 700,Project
90,All Business Sizes,Wordpress,Website Redesign and Rebranding,WP-WRAR-7790,website-redesign-and-rebranding,Redesigning existing websites to align with new branding or market shifts. Improving user experience (UX) and user interface (UI).,Digital Delivery,51107856020180,1,1-3 Business Days,"Prototyping, A/B testing for design elements",1000,"800 - 1,500",Project
91,All Business Sizes,Wordpress,Migration Services,WP-MS-7724,migration-services,Migrating websites to WordPress from other platforms.  Transferring WordPress sites between hosting providers without downtime.,Digital Delivery,18147609107602,1,1-3 Business Days,"Data validation, SEO migration plans",600,500 - 900,Project
92,All Business Sizes,Wordpress,Accessibility and Usability Enhancements,WP-AAUE-3264,accessibility-and-usability-enhancements,Ensuring websites meet accessibility standards (WCAG 2.1). Conducting usability testing and making necessary adjustments.,Digital Delivery,58270370800401,1,1-3 Business Days,"Custom accessibility testing, detailed compliance reports",700,"600 - 1,000",Project
93,All Business Sizes,Writing,Blog Writing,W-BW-8810,blog-writing,"Generate ideas, outlines, and content for blogs. Offer writing services to clients.",Digital Delivery,25903365253926,1,1 Hour,"SEO optimization, long-form content",50,40 - 100,Hour
94,All Business Sizes,Writing,Copywriting,W-C-3122,copywriting,"Develop marketing copy for websites, emails, and advertisements.",Digital Delivery,81093655936224,1,1 Hour,"Brand tone customization, multiple revisions",50,100 - 200,Hour
95,All Business Sizes,Writing,Editing and Proofreading,W-EAP-5051,editing-and-proofreading,Assist with editing and proofreading tasks to ensure high-quality content.,Digital Delivery,64299921779656,1,1 Hour,"Rush service, advanced grammar check",50,50 - 100,Hour
96,All Business Sizes,Writing,Transcription Services,W-TS-2118,transcription-services,Offer transcription services for audio and video content.,Digital Delivery,67414121775440,1,1 Hour,"Timestamped transcription, multilingual support",50,80 - 150,Hour
97,All Business Sizes,Writing,Translation Services,W-TS-2213,translation-services,Help translate text between English and Spanish language for various purposes.,Digital Delivery,43691172281110,1,1 Hour,"Additional languages, priority delivery",50,100 - 200,Hour
98,All Business Sizes,Writing,Story Writing,W-SW-2917,story-writing,"Write stories, novels, or screenplays. Offer ghostwriting services.",Digital Delivery,82184561311841,1,1 Hour,"Illustrations, co-authoring",50,300 - 600,Hour
99,All Business Sizes,Writing,Game Development,W-GD-8366,game-development,"Create storylines, dialogues, and game content for game development.",Digital Delivery,11634228763467,1,1 Hour,"Custom characters, plotlines",50,"800 - 1,500",Hour
100,All Business Sizes,Writing,E-books and Guides,W-AG-1608,e-books-and-guides,"Create and sell e-books, guides, and templates on various topics.",Digital Delivery,54061783574524,1,1 Hour,"Printable templates, resale rights",50,80 - 120,Hour
101,All Business Sizes,Writing,Ad Copy,W-AC-9739,ad-copy,Create effective ad copy for online advertisements.,Digital Delivery,49243897834070,1,1 Hour,"A/B testing, conversion-focused writing",50,80 - 150,Hour
